0,1,2,3,4,5,6,7,8,9,10,11
,,,,,,,,,Progressive,Progressive,Progressive
,,,,,,,,,,,
,Date,Versus,Ground,How Dismissed,Runs,B/F,S/R,,Aggr,Avg,S/R
1,25/12/2015,Zimbabwe,Sharjah Cricket Stadium,c L M Jongwe b A G Cremer,0,12,0.00,,0,0.00,0.00
2,17/07/2016,Ireland,Civil Service Cricket Club,did not bat,-,-,-,,0,0.00,0.00
3,19/07/2016,Ireland,Civil Service Cricket Club,not out,3*,7,42.86,,3,3.00,15.79
4,11/11/2019,West Indies,Bharat Ratna Shri Atal Bihari Vajpayee Ekana Cricket Stadium,did not bat,-,-,-,,3,3.00,15.79
No. of Innings Played = 2,No. of Innings Played = 2,No. of Innings Played = 2,No. of Innings Played = 2,No. of Innings Played = 2,No. of Innings Played = 2,No. of Innings Played = 2,No. of Innings Played = 2,No. of Innings Played = 2,No. of Innings Played = 2,,
