0,1,2,3,4,5,6,7,8,9,10,11
,,,,,,,,Progressive,Progressive,Progressive,Progressive
,,,,,,,,,,,
,Date,Versus,Ground,Batsman Dismissed,Overs,Wickets,,S/R,E/R,Wkts,Avg
1.0,30/08/2009,Netherlands,VRA Ground,,7.0,0/20,,,2.86,,
2.0,10/07/2010,Netherlands,Hazelaarweg,A N Kervezee (c Mohammad Nabi),6.0,2/20,,39.00,3.08,1,20.00
,,,,E S Szwarczynski (c †Mohammad Shahzad),,,,,,2,
3.0,16/08/2010,Scotland,Cambusdoon New Ground,J H Davey (lbw),10.0,1/27,,46.00,2.91,3,22.33
4.0,17/08/2010,Scotland,Cambusdoon New Ground,G M Hamilton (c Nawroz Mangal),8.0,1/27,,46.50,3.03,4,23.50
5.0,07/10/2010,Kenya,Gymkhana Club Ground,S O Tikolo (b),10.0,4/35,,30.75,3.15,5,16.13
,,,,C O Obuya (c †Mohammad Shahzad),,,,,,6,
,,,,M A Ouma (c †Mohammad Shahzad),,,,,,7,
,,,,N N Odhiambo (b),,,,,,8,
6.0,09/10/2010,Kenya,Gymkhana Club Ground,N N Odhiambo (lbw),9.0,1/29,,33.33,3.16,9,17.56
7.0,11/10/2010,Kenya,Gymkhana Club Ground,,3.0,0/15,,35.33,3.26,,19.22
8.0,07/08/2011,Canada,Maple Leaf North - West Ground,Usman Limbada (c Karim Sadiq ),9.0,1/48,,37.20,3.56,10,22.10
9.0,09/08/2011,Canada,"Cricket, Skating & Curling Club",Z E Surkari (c Dawlat Zadran),3.0,1/33,,35.45,3.91,11,23.09
10.0,10/02/2012,Pakistan,Sharjah Cricket Stadium,,5.0,0/27,,38.18,4.01,,25.55
11.0,31/03/2012,Netherlands,Sharjah Cricket Stadium,,9.0,0/47,,43.09,4.15,,29.82
12.0,02/10/2013,Kenya,Sharjah Cricket Stadium,,4.0,0/5,,45.27,4.01,,30.27
13.0,27/02/2014,Pakistan,Khan Shaheb Osman Ali Stadium,Mohammad Hafeez (c Mohammad Nabi),8.0,2/29,,42.00,3.98,12,27.85
,,,,Anwar Ali (c Nawroz Mangal),,,,,,13,
14.0,01/03/2014,Bangladesh,Khan Shaheb Osman Ali Stadium,Nasir Hossain (c Samiullah Shinwari),9.0,1/51,,42.86,4.13,14,29.50
15.0,03/03/2014,Sri Lanka,Shere Bangla National Stadium,D P M D Jayawardene (c Mohammad Nabi),8.0,2/29,,40.50,4.09,15,27.63
,,,,M D K J Perera (b),,,,,,16,
16.0,05/03/2014,India,Shere Bangla National Stadium,A M Rahane (lbw),5.0,1/26,,39.88,4.14,17,27.53
17.0,01/05/2014,Hong Kong,Bayuemas Oval,,10.0,0/25,,43.41,4.01,,29.00
18.0,02/05/2014,United Arab Emirates,Kinrara Academy Oval,S P Patil (b),7.0,1/28,,43.33,4.01,18,28.94
19.0,18/07/2014,Zimbabwe,Queens Sports Club,,6.0,0/32,,45.33,4.07,,30.72
20.0,24/07/2014,Zimbabwe,Queens Sports Club,M N Waller (lbw),6.0,1/21,,44.84,4.04,19,30.21
21.0,28/11/2014,United Arab Emirates,ICC Global Cricket Academy,Amjad Ali (c †Afsar Zazai),10.0,1/39,,45.60,4.03,20,30.65
22.0,30/11/2014,United Arab Emirates,ICC Global Cricket Academy,,7.2,0/54,,47.80,4.19,,33.35
23.0,02/12/2014,United Arab Emirates,ICC Global Cricket Academy,A R Berenger (c Fareed Ahmad),9.0,1/44,,48.10,4.22,21,33.86
24.0,04/12/2014,United Arab Emirates,ICC Global Cricket Academy,,5.0,0/23,,49.52,4.23,,34.95
25.0,08/01/2015,Scotland,ICC Global Cricket Academy,K J Coetzer (c †Afsar Zazai),9.0,2/39,,47.57,4.24,22,33.61
,,,,M W Machan (c †Afsar Zazai),,,,,,23,
26.0,10/01/2015,Ireland,Dubai International Cricket Stadium,,5.0,0/23,,48.87,4.25,,34.61
27.0,14/01/2015,Scotland,Sheikh Zayed Stadium,M W Machan (lbw),10.0,1/28,,49.33,4.18,24,34.33
28.0,17/01/2015,Ireland,Dubai International Cricket Stadium,N J O'Brien (b),10.0,2/43,,47.85,4.18,25,33.35
,,,,G C Wilson (c †Afsar Zazai),,,,,,26,
29.0,18/02/2015,Bangladesh,Manuka Oval,Tamim Iqbal (c †Afsar Zazai),9.0,2/32,,46.36,4.16,27,32.11
,,,,Anamul Haque (lbw),,,,,,28,
30.0,22/02/2015,Sri Lanka,University Oval,,8.1,0/31,,48.11,4.14,,33.21
31.0,22/10/2015,Zimbabwe,Queens Sports Club,,7.0,0/23,,49.61,4.12,,34.04
32.0,24/10/2015,Zimbabwe,Queens Sports Club,C R Ervine (c †Mohammad Shahzad),8.0,1/26,,49.55,4.09,29,33.76
33.0,25/12/2015,Zimbabwe,Sharjah Cricket Stadium,C R Ervine (c Dawlat Zadran),5.0,2/13,,47.32,4.06,30,32.00
,,,,R Mutumbami (b),,,,,,31,
34.0,29/12/2015,Zimbabwe,Sharjah Cricket Stadium,,8.0,0/37,,48.87,4.08,,33.19
35.0,02/01/2016,Zimbabwe,Sharjah Cricket Stadium,E Chigumbura (b),8.0,3/20,,45.97,4.03,32,30.85
,,,,A G Cremer (c Mohammad Nabi),,,,,,33,
,,,,Sikandar Raza (b),,,,,,34,
36.0,04/01/2016,Zimbabwe,Sharjah Cricket Stadium,M N Waller (c Hashmatullah Shahidi),9.1,2/36,,44.94,4.02,35,30.14
,,,,T S Chisoro (b),,,,,,36,
37.0,06/01/2016,Zimbabwe,Sharjah Cricket Stadium,P J Moor (c Noor Ali Zadran),7.0,1/28,,44.86,4.02,37,30.08
38.0,06/07/2016,Scotland,Grange Cricket Club,C D de Lange (c Javed Ahmadi),4.1,1/13,,44.34,4.01,38,29.63
39.0,12/07/2016,Ireland,Civil Service Cricket Club,E C Joyce (c †Mohammad Shahzad),10.0,2/40,,43.63,4.01,39,29.15
,,,,S W Poynter (lbw),,,,,,40,
40.0,14/07/2016,Ireland,Civil Service Cricket Club,,6.0,0/33,,44.53,4.04,,29.98
41.0,17/07/2016,Ireland,Civil Service Cricket Club,,7.0,0/22,,45.58,4.02,,30.53
42.0,19/07/2016,Ireland,Civil Service Cricket Club,W T S Porterfield (c Rahmat Shah),8.0,1/22,,45.63,3.99,41,30.32
43.0,25/09/2016,Bangladesh,Shere Bangla National Stadium,Tamim Iqbal (c Naveen -ul-Haq),10.0,1/51,,45.98,4.02,42,30.81
44.0,28/09/2016,Bangladesh,Shere Bangla National Stadium,Tamim Iqbal (c Dawlat Zadran),5.0,2/23,,44.57,4.03,43,29.93
,,,,Soumya Sarkar (c Hashmatullah Shahidi),,,,,,44,
45.0,01/10/2016,Bangladesh,Shere Bangla National Stadium,Mashrafe Mortaza (c Nawroz Mangal),8.0,2/43,,43.67,4.06,45,29.57
,,,,Soumya Sarkar (c †Mohammad Shahzad),,,,,,46,
