0,1,2,3,4,5,6,7,8,9,10,11
,,,,,,,,Progressive,Progressive,Progressive,Progressive
,,,,,,,,,,,
,Date,Versus,Ground,Batsman Dismissed,Overs,Wickets,,S/R,E/R,Wkts,Avg
1.0,19/05/1993,Australia,Old Trafford,I A Healy (c G P Thorpe),11.0,1/50,,66.00,4.55,1,50.00
2.0,21/05/1993,Australia,Edgbaston,,11.0,0/43,,132.00,4.23,,93.00
3.0,23/05/1993,Australia,Lord's,M E Waugh (c †A J Stewart),11.0,3/39,,49.50,4.00,2,33.00
,,,,S R Waugh (c G A Gooch),,,,,,3,
,,,,M L Hayden (c †A J Stewart),,,,,,4,
4.0,05/03/1994,West Indies,Queen's Park Oval,R B Richardson (c M R Ramprakash),10.0,1/60,,51.60,4.47,5,38.40
5.0,06/03/1994,West Indies,Queen's Park Oval,B C Lara (c †A J Stewart),10.0,1/66,,53.00,4.87,6,43.00
6.0,23/02/1997,New Zealand,Eden Park,C Z Harris (c sub),6.0,2/33,,44.25,4.93,7,36.38
,,,,L K Germon (b),,,,,,8,
7.0,26/02/1997,New Zealand,McLean Park,C L Cairns (c D G Cork),10.0,2/43,,41.40,4.84,9,33.40
,,,,B A Young (b),,,,,,10,
8.0,02/03/1997,New Zealand,Eden Park,A C Parore (c R D B Croft),8.0,2/29,,38.50,4.71,11,30.25
,,,,H T Davis (b),,,,,,12,
9.0,04/03/1997,New Zealand,Basin Reserve,A C Parore (lbw),10.0,3/35,,34.80,4.57,13,26.53
,,,,B A Young (c †R C Russell),,,,,,14,
,,,,N J Astle (c M A Atherton),,,,,,15,
10.0,23/01/2000,South Africa,Mangaung Oval,H H Gibbs (lbw),10.0,1/23,,36.38,4.34,16,26.31
11.0,26/01/2000,South Africa,Newlands,P C Strydom (b),10.0,1/29,,37.76,4.21,17,26.47
12.0,28/01/2000,Zimbabwe,Newlands,A Flower (c V S Solanki),10.0,1/30,,39.00,4.10,18,26.67
13.0,30/01/2000,Zimbabwe,Diamond Oval,N C Johnson (c N Hussain),10.0,1/21,,40.11,3.94,19,26.37
14.0,04/02/2000,South Africa,Buffalo Park,M V Boucher (c N V Knight),10.0,1/50,,41.10,4.02,20,27.55
15.0,13/02/2000,South Africa,Wanderers Stadium,J N Rhodes (c G A Hick),9.0,4/19,,36.50,3.90,21,23.75
,,,,S M Pollock (c C White),,,,,,22,
,,,,P C Strydom (c D L Maddy),,,,,,23,
,,,,N D McKenzie (b),,,,,,24,
16.0,16/02/2000,Zimbabwe,Queens Sports Club,,10.0,0/36,,39.00,3.88,,25.25
17.0,18/02/2000,Zimbabwe,Queens Sports Club,A D R Campbell (c G A Hick),10.0,2/24,,38.31,3.80,25,24.23
,,,,H H Streak (c G A Hick),,,,,,26,
18.0,20/02/2000,Zimbabwe,Harare Sports Club,,8.0,0/7,,40.15,3.66,,24.50
19.0,08/07/2000,Zimbabwe,Kennington Oval,C B Wishart (lbw),10.0,2/27,,39.43,3.61,27,23.71
,,,,N C Johnson (c M P Maynard),,,,,,28,
20.0,13/07/2000,Zimbabwe,Old Trafford,N C Johnson (c †A J Stewart),8.0,1/26,,39.72,3.59,29,23.79
21.0,15/07/2000,West Indies,Riverside Ground,C H Gayle (c G P Thorpe),10.0,1/30,,40.40,3.56,30,24.00
22.0,18/07/2000,Zimbabwe,Edgbaston,G J Whittall (c C White),8.0,1/22,,40.65,3.53,31,23.94
23.0,22/07/2000,Zimbabwe,Lord's,N C Johnson (b),10.0,1/23,,41.25,3.48,32,23.91
24.0,05/10/2000,Bangladesh,Gymkhana Club Ground,Naimuir Rahman (c N Hussain),10.0,2/35,,40.59,3.48,33,23.53
,,,,Al Sahariar Rokon (c M W Alleyne),,,,,,34,
25.0,10/10/2000,South Africa,Gymkhana Club Ground,,7.0,0/40,,41.82,3.54,,24.71
26.0,24/10/2000,Pakistan,National Stadium (Karachi),Imran Nazir (b),10.0,1/53,,42.34,3.62,35,25.51
27.0,27/10/2000,Pakistan,Gaddafi Stadium,,10.0,0/37,,44.06,3.62,,26.57
28.0,30/10/2000,Pakistan,Rawalpindi Cricket Stadium,Shahid Afridi (c N Hussain),9.0,2/46,,43.14,3.67,36,26.38
,,,,Imran Nazir (c G A Hick),,,,,,37,
29.0,23/03/2001,Sri Lanka,Rangiri Dambulla International Stadium,R S Kaluwitharana (c †A J Stewart),8.0,2/42,,42.15,3.72,38,26.10
,,,,K C Sangakkara (c †A J Stewart),,,,,,39,
30.0,25/03/2001,Sri Lanka,R Premadasa Stadium,S I De Saram (b),10.0,1/37,,42.60,3.71,40,26.38
31.0,12/06/2001,Pakistan,Lord's,Inzamam-ul-Haq (b),10.0,2/37,,42.00,3.71,41,26.00
,,,,Shahid Afridi (c M E Trescothick),,,,,,42,
32.0,14/06/2001,Australia,Old Trafford,M L Hayden (c D Gough),10.0,2/45,,41.45,3.74,43,25.84
,,,,R T Ponting (c N V Knight),,,,,,44,
33.0,17/06/2001,Pakistan,Headingley,,10.0,0/28,,42.82,3.71,,26.48
34.0,21/06/2001,Australia,Kennington Oval,M L Hayden (c A D Mullally),8.0,1/51,,42.93,3.78,45,27.02
35.0,31/01/2002,India,Arun Jaitley Stadium,S R Tendulkar (c †J S Foster),10.0,1/39,,43.30,3.78,46,27.28
36.0,03/02/2002,India,Wankhede Stadium,A B Agarkar (c †J S Foster),10.0,2/61,,42.75,3.85,47,27.42
,,,,V Sehwag (c G P Thorpe),,,,,,48,
37.0,13/02/2002,New Zealand,AMI Stadium,,7.3,0/51,,43.69,3.91,,28.48
38.0,18/09/2002,Zimbabwe,R Premadasa Stadium,,10.0,0/37,,44.94,3.91,,29.25
39.0,22/09/2002,India,R Premadasa Stadium,,7.0,0/59,,45.81,3.99,,30.48
40.0,13/12/2002,Australia,Sydney Cricket Ground,,6.0,0/35,,46.56,4.02,,31.21
41.0,17/12/2002,Sri Lanka,Brisbane Cricket Ground,R S Kaluwitharana (c †A J Stewart),10.0,1/53,,46.84,4.05,49,31.65
42.0,20/12/2002,Sri Lanka,WACA Ground,M S Atapattu (c N V Knight),10.0,3/30,,45.29,4.03,50,30.40
,,,,S T Jayasuriya (c & b),,,,,,51,
,,,,J Mubarak (c N Hussain),,,,,,52,
43.0,11/01/2003,Australia,Bellerive Oval,,10.0,0/54,,46.44,4.06,,31.44
44.0,13/01/2003,Sri Lanka,Sydney Cricket Ground,M S Atapattu (c N V Knight),10.0,2/29,,45.83,4.03,53,30.81
,,,,P A de Silva (c †A J Stewart),,,,,,54,
45.0,17/01/2003,Sri Lanka,Adelaide Oval,M S Atapattu (b),10.0,4/35,,43.71,4.02,55,29.29
,,,,H P Tillakaratne (c †A J Stewart),,,,,,56,
,,,,R P Arnold (c I D Blackwell),,,,,,57,
,,,,K C Sangakkara (c I D Blackwell),,,,,,58,
46.0,19/01/2003,Australia,Adelaide Oval,A C Gilchrist (c M E Trescothick),10.0,1/34,,43.98,4.01,59,29.37
47.0,23/01/2003,Australia,Sydney Cricket Ground,,3.0,0/31,,44.29,4.05,,29.90
48.0,25/01/2003,Australia,Melbourne Cricket Ground,D R Martyn (c †A J Stewart),10.0,2/23,,43.82,4.01,60,29.30
,,,,R T Ponting (c A Flintoff),,,,,,61,
49.0,16/02/2003,Netherlands,Buffalo Park,,10.0,0/19,,44.80,3.96,,29.61
50.0,19/02/2003,Namibia,St George's Park,,8.0,0/28,,45.59,3.96,,30.07
51.0,22/02/2003,Pakistan,Newlands,Shahid Afridi (c †A J Stewart),7.0,1/27,,45.53,3.96,62,30.02
52.0,26/02/2003,India,Kingsmead,J Srinath (c M E Trescothick),10.0,3/69,,44.35,4.02,63,29.69
,,,,R Dravid (c P D Collingwood),,,,,,64,
,,,,M Kaif (c A Flintoff),,,,,,65,
53.0,02/03/2003,Australia,St George's Park,D R Martyn (lbw),9.0,4/35,,42.57,4.01,66,28.48
,,,,M L Hayden (c A F Giles),,,,,,67,
,,,,R T Ponting (c A F Giles),,,,,,68,
,,,,A C Gilchrist (c M P Vaughan),,,,,,69,
