0,1,2,3,4,5,6,7,8,9,10,11
,,,,,,,,Progressive,Progressive,Progressive,Progressive
,,,,,,,,,,,
,Date,Versus,Ground,Batsman Dismissed,Overs,Wickets,,S/R,E/R,Wkts,Avg
1.0,16/06/2013,England,Sophia Gardens,,1.0,0/4,,,4.00,,
2.0,29/10/2013,Bangladesh,Shere Bangla National Stadium,Abdur Razzak (c †B B McCullum),8.5,2/46,,29.50,5.08,1,25.00
,,,,Sohag Gazi (c †B B McCullum),,,,,,2,
3.0,31/10/2013,Bangladesh,Shere Bangla National Stadium,Tamim Iqbal (b),9.0,4/40,,18.83,4.78,3,15.00
,,,,Mahmudullah (c & b),,,,,,4,
,,,,Sohag Gazi (c A P Devcich),,,,,,5,
,,,,Mominul Haque (c N L McCullum),,,,,,6,
4.0,03/11/2013,Bangladesh,Khan Shaheb Osman Ali Stadium,Shamsur Rahman (c †L Ronchi),10.0,1/56,,24.71,5.06,7,20.86
5.0,10/11/2013,Sri Lanka,Mahinda Rajapaksha International Cricket Stadium,T M Dilshan (c †L Ronchi),4.0,1/32,,24.63,5.42,8,22.25
6.0,26/12/2013,West Indies,Eden Park,,4.0,0/19,,27.63,5.35,,24.63
7.0,04/01/2014,West Indies,Saxton Oval,,2.0,0/10,,29.13,5.33,,25.88
8.0,07/01/2014,West Indies,Seddon Park,L M P Simmons (c K S Williamson),10.0,1/77,,32.56,5.82,9,31.56
9.0,19/01/2014,India,McLean Park,S Dhawan (c L R P L Taylor),10.0,2/51,,32.09,5.69,10,30.45
,,,,A M Rahane (c N L McCullum),,,,,,11,
10.0,22/01/2014,India,Seddon Park,M S Dhoni (c K S Williamson),7.3,3/67,,28.43,6.06,12,28.71
,,,,R A Jadeja (b),,,,,,13,
,,,,B Kumar (c N L McCullum),,,,,,14,
11.0,25/01/2014,India,Eden Park,M S Dhoni (c T G Southee),10.0,5/63,,24.11,6.09,15,24.47
,,,,R G Sharma (c H K Bennett),,,,,,16,
,,,,S Dhawan (c M J Guptill),,,,,,17,
,,,,A M Rahane (c †L Ronchi),,,,,,18,
,,,,Mohammed Shami (c K S Williamson),,,,,,19,
12.0,21/10/2014,South Africa,Bay Oval,R R Rossouw (c D G Brownlie),6.0,1/31,,24.70,6.02,20,24.80
13.0,24/10/2014,South Africa,Bay Oval,D W Steyn (c †L Ronchi),4.0,2/30,,23.55,6.09,21,23.91
,,,,D A Miller (b),,,,,,22,
14.0,27/10/2014,South Africa,Seddon Park,,2.0,0/11,,24.09,6.08,,24.41
15.0,12/12/2014,Pakistan,Sharjah Cricket Stadium,Haris Sohail (c L R P L Taylor),7.0,1/35,,24.87,6.00,23,24.87
16.0,14/12/2014,Pakistan,Sharjah Cricket Stadium,Mohammad Hafeez (c †L Ronchi),10.0,1/96,,26.33,6.34,24,27.83
17.0,17/12/2014,Pakistan,Sheikh Zayed Stadium,Nasir Jamshed (lbw),8.0,1/40,,27.20,6.25,25,28.32
18.0,11/01/2015,Sri Lanka,Hagley Oval,S M S M Senanayake (c †L Ronchi),10.0,1/61,,28.46,6.24,26,29.58
19.0,15/01/2015,Sri Lanka,Seddon Park,,4.0,0/20,,29.38,6.20,,30.35
20.0,20/01/2015,Sri Lanka,Saxton Oval,D P M D Jayawardene (c †L Ronchi),3.0,1/19,,28.96,6.20,27,29.93
21.0,23/01/2015,Sri Lanka,University Oval,,5.0,0/41,,30.07,6.27,,31.44
22.0,25/01/2015,Sri Lanka,University Oval,D P M D Jayawardene (c B B McCullum),10.0,4/52,,28.13,6.20,28,29.06
,,,,T M Dilshan (c †L Ronchi),,,,,,29,
,,,,N L T C Perera (lbw),,,,,,30,
,,,,F D M Karunaratne (c K D Mills),,,,,,31,
23.0,28/01/2015,Sri Lanka,Westpac Stadium,N L T C Perera (c K D Mills),9.0,3/59,,27.24,6.22,32,28.24
,,,,H D R L Thirimanne (lbw),,,,,,33,
,,,,L D Chandimal (c †L Ronchi),,,,,,34,
24.0,31/01/2015,Pakistan,Westpac Stadium,Sarfaraz Ahmed (c T W M Latham),6.0,2/47,,26.72,6.28,35,27.97
,,,,Haris Sohail (c M J Guptill),,,,,,36,
25.0,14/02/2015,Sri Lanka,Hagley Oval,H M R K B Herath (c A F Milne),3.1,2/18,,25.82,6.27,37,26.97
,,,,K M D N Kulasekara (c G D Elliott),,,,,,38,
26.0,17/02/2015,Scotland,University Oval,R D Berrington (c A F Milne),5.0,3/18,,24.66,6.19,39,25.44
,,,,M W Machan (c B B McCullum),,,,,,40,
,,,,M H Cross (c †L Ronchi),,,,,,41,
27.0,20/02/2015,England,Westpac Stadium,,2.0,0/8,,24.95,6.16,,25.63
28.0,28/02/2015,Australia,Eden Park,B J Haddin (c sub),0.2,1/6,,24.40,6.19,42,25.17
29.0,08/03/2015,Afghanistan,McLean Park,Samiullah Shinwari (c L R P L Taylor),6.4,2/38,,24.20,6.17,43,24.89
,,,,Hamid Hassan (c A F Milne),,,,,,44,
30.0,13/03/2015,Bangladesh,Seddon Park,Mushfiqur Rahim (c †L Ronchi),10.0,2/43,,24.46,6.07,45,24.74
,,,,Shakib Al Hasan (c †L Ronchi),,,,,,46,
31.0,21/03/2015,West Indies,Westpac Stadium,D J G Sammy (c †L Ronchi),2.0,1/24,,24.19,6.13,47,24.72
32.0,24/03/2015,South Africa,Eden Park,D A Miller (c †L Ronchi),6.0,3/72,,23.46,6.31,48,24.68
,,,,F du Plessis (c †L Ronchi),,,,,,49,
,,,,R R Rossouw (c M J Guptill),,,,,,50,
33.0,29/03/2015,Australia,Melbourne Cricket Ground,,1.0,0/7,,23.58,6.32,,24.82
34.0,25/01/2016,Pakistan,Basin Reserve,Babar Azam (c H M Nicholls),9.0,1/35,,24.18,6.21,51,25.02
35.0,31/01/2016,Pakistan,Eden Park,Wahab Riaz (c M J Guptill),4.0,1/26,,24.17,6.21,52,25.04
36.0,03/02/2016,Australia,Eden Park,M S Wade (c H M Nicholls),4.0,1/14,,24.17,6.16,53,24.83
37.0,06/02/2016,Australia,Westpac Stadium,,3.0,0/17,,24.51,6.16,,25.15
38.0,08/02/2016,Australia,Seddon Park,J W Hastings (c G D Elliott),6.0,2/16,,24.27,6.06,54,24.53
,,,,A Zampa (c B B McCullum),,,,,,55,
39.0,29/10/2016,India,Dr YS Rajasekhara Reddy Cricket Stadium,,4.0,0/27,,24.71,6.08,,25.02
40.0,21/05/2017,Ireland,The Village,E C Joyce (c †L Ronchi),4.0,2/15,,24.26,6.03,56,24.40
,,,,A Balbirnie (c L R P L Taylor),,,,,,57,
41.0,24/05/2017,Bangladesh,Castle Avenue,,5.0,0/37,,24.79,6.06,,25.05
42.0,06/06/2017,England,Sophia Gardens,E J G Morgan (c †L Ronchi),9.0,3/55,,24.45,6.07,58,24.72
,,,,J E Root (b),,,,,,59,
,,,,M M Ali (c T A Boult),,,,,,60,
43.0,09/06/2017,Bangladesh,Sophia Gardens,,3.0,0/19,,24.75,6.07,,25.03
