0,1,2,3,4,5,6,7,8,9,10,11
,,,,,,,,,Progressive,Progressive,Progressive
,,,,,,,,,,,
,Date,Versus,Ground,How Dismissed,Runs,B/F,S/R,,Aggr,Avg,S/R
1,16/11/2015,United Arab Emirates,ICC Global Cricket Academy,not out,124*,116,106.90,,124,,106.90
2,18/11/2015,United Arab Emirates,ICC Global Cricket Academy,c Umair Ali b Nasir Aziz,27,35,77.14,,151,151.00,100.00
3,28/02/2018,England,Bay Oval,c D J Willey b C R Woakes,1,6,16.67,,152,76.00,96.82
4,03/03/2018,England,Westpac Stadium,c E J G Morgan b M M Ali,8,14,57.14,,160,53.33,93.57
5,10/03/2018,England,Hagley Oval,b M M Ali,0,3,0.00,,160,40.00,91.95
No. of Innings Played = 5,No. of Innings Played = 5,No. of Innings Played = 5,No. of Innings Played = 5,No. of Innings Played = 5,No. of Innings Played = 5,No. of Innings Played = 5,No. of Innings Played = 5,No. of Innings Played = 5,No. of Innings Played = 5,,
