0,1,2,3,4,5,6,7,8,9,10,11
,,,,,,,,,Progressive,Progressive,Progressive
,,,,,,,,,,,
,Date,Versus,Ground,How Dismissed,Runs,B/F,S/R,,Aggr,Avg,S/R
1,11/04/2003,Bangladesh,Bangabandhu National Stadium,c †Khaled Mashud b Tapash Baisya,11,22,50.00,,11,11.00,50.00
2,13/04/2003,South Africa,Bangabandhu National Stadium,c †M V Boucher b M Ntini,18,30,60.00,,29,14.50,55.77
3,16/04/2003,Bangladesh,Bangabandhu National Stadium,c †Khaled Mashud b Alok Kapali,71,89,79.78,,100,33.33,70.92
4,18/04/2003,South Africa,Bangabandhu National Stadium,c A J Hall b M Ntini,2,11,18.18,,102,25.50,67.11
5,21/04/2003,South Africa,Bangabandhu National Stadium,c N D McKenzie b M Ntini,11,33,33.33,,113,22.60,61.08
6,06/11/2005,Sri Lanka,Sardar Patel Stadium,c M S Atapattu b M F Maharoof,103,97,106.19,,216,36.00,76.60
7,09/11/2005,Sri Lanka,Madhavrao Scindia Cricket Ground,b C R D Fernando,28,27,103.70,,244,34.86,78.96
8,16/11/2005,South Africa,Rajiv Gandhi International Stadium,c †M V Boucher b M Ntini,1,4,25.00,,245,30.63,78.27
9,19/11/2005,South Africa,M Chinnaswamy Stadium,run out,38,50,76.00,,283,31.44,77.96
10,25/11/2005,South Africa,Eden Gardens,c G C Smith b S M Pollock,11,19,57.89,,294,29.40,76.96
11,28/11/2005,South Africa,Wankhede Stadium,c J M Kemp b M Ntini,0,7,0.00,,294,26.73,75.58
12,13/02/2006,Pakistan,Gaddafi Stadium,b Mohammad Asif,2,8,25.00,,296,24.67,74.56
13,16/02/2006,Pakistan,Multan Cricket Stadium,c & b Mohammad Sami,21,20,105.00,,317,24.38,76.02
14,19/02/2006,Pakistan,National Stadium (Karachi),c †Kamran Akmal b Iftikhar Anjum,38,50,76.00,,355,25.36,76.02
15,28/03/2006,England,Arun Jaitley Stadium,c †G O Jones b Kabir Ali,25,27,92.59,,380,25.33,76.92
16,31/03/2006,England,Nahar Singh Stadium,c & b J M Anderson,29,45,64.44,,409,25.56,75.88
17,21/01/2007,West Indies,Vidarbha Cricket Association Ground,c M N Samuels b C H Gayle,69,75,92.00,,478,28.12,77.85
18,24/01/2007,West Indies,Barabati Stadium,c †D Ramdin b I D R Bradshaw,2,11,18.18,,480,26.67,76.80
19,27/01/2007,West Indies,MA Chidambaram Stadium,c L M P Simmons b D B Powell,0,6,0.00,,480,25.26,76.07
20,10/05/2007,Bangladesh,Shere Bangla National Stadium,lbw b Syed Rasel,21,17,123.53,,501,25.05,77.31
21,12/05/2007,Bangladesh,Shere Bangla National Stadium,b Syed Rasel,101,113,89.38,,602,28.67,79.11
22,23/06/2007,Ireland,Civil Service Cricket Club,not out,80*,107,74.77,,682,32.48,78.57
23,26/06/2007,South Africa,Civil Service Cricket Club,c J H Kallis b A Nel,0,7,0.00,,682,31.00,77.94
24,01/07/2007,South Africa,Civil Service Cricket Club,b D W Steyn,5,11,45.45,,687,29.87,77.54
25,16/08/2007,Scotland,Titwood,not out,85*,115,73.91,,772,33.57,77.12
26,21/08/2007,England,The Rose Bowl,c †M J Prior b J M Anderson,3,14,21.43,,775,32.29,76.35
27,02/09/2007,England,Headingley,c sub b S C J Broad,51,66,77.27,,826,33.04,76.41
28,05/09/2007,England,Kennington Oval,c M S Panesar b A D Mascarenhas,47,57,82.46,,873,33.58,76.71
29,08/09/2007,England,Lord's,c L J Wright b J M Anderson,12,20,60.00,,885,32.78,76.42
30,29/09/2007,Australia,M Chinnaswamy Stadium,not out,4*,10,40.00,,889,32.93,76.11
31,02/10/2007,Australia,Nehru Stadium (Kochi),b M G Johnson,7,13,53.85,,896,32.00,75.87
32,05/10/2007,Australia,Rajiv Gandhi International Stadium,lbw b B Lee,6,11,54.55,,902,31.10,75.67
33,05/11/2007,Pakistan,Nehru Stadium (Guwahati),b Shahid Afridi,44,51,86.27,,946,31.53,76.11
34,08/11/2007,Pakistan,Punjab Cricket Association IS Bindra Stadium,c Shahid Afridi b Umar Gul,57,68,83.82,,1003,32.35,76.51
35,11/11/2007,Pakistan,Green Park,b Abdur Rehman,25,49,51.02,,1028,32.13,75.59
36,15/11/2007,Pakistan,Captain Roop Singh Stadium,c Sohail Tanvir b Iftikhar Anjum,3,13,23.08,,1031,31.24,75.09
37,18/11/2007,Pakistan,Sawai Mansingh Stadium,lbw b Sohail Tanvir,12,15,80.00,,1043,30.68,75.14
38,03/02/2008,Australia,Brisbane Cricket Ground,lbw b M G Johnson,39,51,76.47,,1082,30.91,75.19
39,04/02/2008,Sri Lanka,Brisbane Cricket Ground,not out,102*,101,100.99,,1184,33.83,76.88
40,10/02/2008,Australia,Melbourne Cricket Ground,c M J Clarke b B Lee,21,43,48.84,,1205,33.47,76.12
41,12/02/2008,Sri Lanka,Manuka Oval,run out,35,33,106.06,,1240,33.51,76.73
42,17/02/2008,Australia,Adelaide Oval,c R T Ponting b M G Johnson,34,42,80.95,,1274,33.53,76.84
43,19/02/2008,Sri Lanka,Adelaide Oval,c †K C Sangakkara b M K D Amerasinghe,15,34,44.12,,1289,33.05,76.18
44,24/02/2008,Australia,Sydney Cricket Ground,st A C Gilchrist b G B Hogg,113,119,94.96,,1402,35.05,77.42
45,26/02/2008,Sri Lanka,Bellerive Oval,not out,63*,89,70.79,,1465,36.63,77.11
46,02/03/2008,Australia,Sydney Cricket Ground,run out,3,4,75.00,,1468,35.80,77.10
47,04/03/2008,Australia,Brisbane Cricket Ground,c M G Johnson b M J Clarke,15,16,93.75,,1483,35.31,77.24
48,10/06/2008,Pakistan,Shere Bangla National Stadium,c †Kamran Akmal b Wahab Riaz,62,62,100.00,,1545,35.93,77.95
49,12/06/2008,Bangladesh,Shere Bangla National Stadium,not out,107*,101,105.94,,1652,38.42,79.31
50,14/06/2008,Pakistan,Shere Bangla National Stadium,c sub b Umar Gul,40,33,121.21,,1692,38.45,79.96
51,25/06/2008,Hong Kong,National Stadium (Karachi),c J P R Lamsam b Najeeb Amar,51,54,94.44,,1743,38.73,80.32
52,26/06/2008,Pakistan,National Stadium (Karachi),c Misbah-ul-Haq b Iftikhar Anjum,9,12,75.00,,1752,38.09,80.29
53,28/06/2008,Bangladesh,National Stadium (Karachi),c Mashrafe Mortaza b Farhad Reza,90,84,107.14,,1842,39.19,81.29
54,02/07/2008,Pakistan,National Stadium (Karachi),c Shahid Afridi b Iftikhar Anjum,35,32,109.38,,1877,39.10,81.68
55,03/07/2008,Sri Lanka,National Stadium (Karachi),lbw b M Muralitharan,68,61,111.48,,1945,39.69,82.45
56,06/07/2008,Sri Lanka,National Stadium (Karachi),c T M Dilshan b W P U J C Vaas,6,13,46.15,,1951,39.02,82.25
57,18/08/2008,Sri Lanka,Rangiri Dambulla International Stadium,b W P U J C Vaas,0,2,0.00,,1951,38.25,82.18
58,24/08/2008,Sri Lanka,R Premadasa Stadium,lbw b K M D N Kulasekara,8,20,40.00,,1959,37.67,81.83
59,27/08/2008,Sri Lanka,R Premadasa Stadium,c T M Dilshan b K M D N Kulasekara,17,21,80.95,,1976,37.28,81.82
60,29/08/2008,Sri Lanka,R Premadasa Stadium,c †K C Sangakkara b K M D N Kulasekara,11,16,68.75,,1987,36.80,81.74
61,14/11/2008,England,Madhavrao Scindia Cricket Ground,c O A Shah b S R Patel,51,63,80.95,,2038,37.05,81.72
62,17/11/2008,England,Holkar Cricket Stadium,b K P Pietersen,70,76,92.11,,2108,37.64,82.02
63,20/11/2008,England,Green Park,c S C J Broad b A Flintoff,14,17,82.35,,2122,37.23,82.03
64,23/11/2008,England,M Chinnaswamy Stadium,c J M Anderson b G P Swann,40,37,108.11,,2162,37.28,82.39
65,28/01/2009,Sri Lanka,Rangiri Dambulla International Stadium,c S H T Kandamby b M Muralitharan,62,68,91.18,,2224,37.69,82.62
66,31/01/2009,Sri Lanka,R Premadasa Stadium,c †K C Sangakkara b M F Maharoof,27,28,96.43,,2251,37.52,82.76
67,03/02/2009,Sri Lanka,R Premadasa Stadium,run out,10,9,111.11,,2261,37.07,82.85
68,05/02/2009,Sri Lanka,R Premadasa Stadium,c †K C Sangakkara b M Muralitharan,150,147,102.04,,2411,38.89,83.83
69,08/02/2009,Sri Lanka,R Premadasa Stadium,c †K C Sangakkara b K M D N Kulasekara,13,15,86.67,,2424,38.48,83.85
70,03/03/2009,New Zealand,McLean Park,did not bat,-,-,-,,2424,38.48,83.85
71,06/03/2009,New Zealand,Westpac Stadium,c G D Elliott b I E O'Brien,30,36,83.33,,2454,38.34,83.84
72,08/03/2009,New Zealand,AMI Stadium,c †P D McGlashan b I G Butler,15,27,55.56,,2469,37.98,83.58
73,11/03/2009,New Zealand,Seddon Park,not out,63*,67,94.03,,2532,38.95,83.81
74,14/03/2009,New Zealand,Eden Park,c †P D McGlashan b K D Mills,5,16,31.25,,2537,38.44,83.54
75,26/06/2009,West Indies,Sabina Park,c D J J Bravo b J E Taylor,13,14,92.86,,2550,38.06,83.58
76,28/06/2009,West Indies,Sabina Park,c †D Ramdin b R Rampaul,0,2,0.00,,2550,37.50,83.52
77,03/07/2009,West Indies,Darren Sammy National Cricket Stadium,c †D Ramdin b S J Benn,44,38,115.79,,2594,37.59,83.92
78,05/07/2009,West Indies,Darren Sammy National Cricket Stadium,did not bat,-,-,-,,2594,37.59,83.92
79,26/09/2009,Pakistan,SuperSport Park,run out,57,46,123.91,,2651,37.87,84.51
80,28/09/2009,Australia,SuperSport Park,did not bat,-,-,-,,2651,37.87,84.51
81,30/09/2009,West Indies,Wanderers Stadium,b K A J Roach,6,5,120.00,,2657,37.42,84.56
82,25/10/2009,Australia,Reliance Stadium,lbw b M G Johnson,68,85,80.00,,2725,37.85,84.44
83,28/10/2009,Australia,Vidarbha Cricket Association Stadium,run out,76,80,95.00,,2801,38.37,84.70
84,31/10/2009,Australia,Arun Jaitley Stadium,b N M Hauritz,6,15,40.00,,2807,37.93,84.50
85,05/11/2009,Australia,Rajiv Gandhi International Stadium,c B W Hilfenhaus b C J McKay,8,13,61.54,,2815,37.53,84.41
86,08/11/2009,Australia,Nehru Stadium (Guwahati),b M G Johnson,0,2,0.00,,2815,37.04,84.36
87,15/12/2009,Sri Lanka,Madhavrao Scindia Cricket Ground,c †K C Sangakkara b K M D N Kulasekara,11,8,137.50,,2826,36.70,84.48
88,18/12/2009,Sri Lanka,Vidarbha Cricket Association Stadium,run out,2,6,33.33,,2828,36.26,84.39
89,21/12/2009,Sri Lanka,Barabati Stadium,c & b S Randiv,32,52,61.54,,2860,36.20,84.04
90,24/12/2009,Sri Lanka,Eden Gardens,not out,150*,137,109.49,,3010,38.10,85.03
91,27/12/2009,Sri Lanka,Arun Jaitley Stadium,did not bat,-,-,-,,3010,38.10,85.03
92,05/01/2010,Sri Lanka,Shere Bangla National Stadium,b U W M B C A Welegedara,8,12,66.67,,3018,37.73,84.97
93,07/01/2010,Bangladesh,Shere Bangla National Stadium,b Rubel Hossain,18,24,75.00,,3036,37.48,84.90
94,10/01/2010,Sri Lanka,Shere Bangla National Stadium,c U W M B C A Welegedara b N L T C Perera,71,86,82.56,,3107,37.89,84.84
95,11/01/2010,Bangladesh,Shere Bangla National Stadium,b Naeem Islam,41,46,89.13,,3148,37.93,84.90
96,13/01/2010,Sri Lanka,Shere Bangla National Stadium,b K M D N Kulasekara,0,2,0.00,,3148,37.48,84.85
97,16/06/2010,Bangladesh,Rangiri Dambulla International Stadium,lbw b Mashrafe Mortaza,82,101,81.19,,3230,38.00,84.75
98,19/06/2010,Pakistan,Rangiri Dambulla International Stadium,b Saeed Ajmal,83,97,85.57,,3313,38.52,84.77
99,22/06/2010,Sri Lanka,Rangiri Dambulla International Stadium,c S Randiv b A D Mathews,23,31,74.19,,3336,38.34,84.69
100,24/06/2010,Sri Lanka,Rangiri Dambulla International Stadium,run out,15,16,93.75,,3351,38.08,84.73
101,28/11/2010,New Zealand,Nehru Stadium (Guwahati),c J M How b A J McKay,38,38,100.00,,3389,38.08,84.87
102,01/12/2010,New Zealand,Sawai Mansingh Stadium,not out,138*,116,118.97,,3527,39.63,85.84
103,04/12/2010,New Zealand,Reliance Stadium,not out,126*,117,107.69,,3653,41.04,86.44
104,07/12/2010,New Zealand,M Chinnaswamy Stadium,c M J Guptill b A J McKay,27,24,112.50,,3680,40.89,86.59
105,10/12/2010,New Zealand,MA Chidambaram Stadium,c †B B McCullum b N L McCullum,0,3,0.00,,3680,40.44,86.53
106,19/02/2011,Bangladesh,Shere Bangla National Stadium,b Mahmudullah,39,39,100.00,,3719,40.42,86.65
107,27/02/2011,England,M Chinnaswamy Stadium,b G P Swann,51,61,83.61,,3770,40.54,86.61
108,06/03/2011,Ireland,M Chinnaswamy Stadium,c A R Cusack b D T Johnston,10,15,66.67,,3780,40.21,86.54
109,09/03/2011,Netherlands,Arun Jaitley Stadium,b Mudassar Bukhari,28,28,100.00,,3808,40.08,86.62
110,12/03/2011,South Africa,Vidarbha Cricket Association Stadium,c J H Kallis b D W Steyn,69,75,92.00,,3877,40.39,86.71
111,20/03/2011,West Indies,MA Chidambaram Stadium,c A D Russell b R Rampaul,22,26,84.62,,3899,40.20,86.70
112,24/03/2011,Australia,Sardar Patel Stadium,run out,50,64,78.13,,3949,40.30,86.58
113,30/03/2011,Pakistan,Punjab Cricket Association IS Bindra Stadium,st Kamran Akmal b Mohammad Hafeez,27,32,84.38,,3976,40.16,86.57
114,02/04/2011,Sri Lanka,Wankhede Stadium,b N L T C Perera,97,122,79.51,,4073,40.73,86.38
115,14/10/2011,England,Rajiv Gandhi International Stadium,lbw b J W Dernbach,32,33,96.97,,4105,40.64,86.46
116,17/10/2011,England,Arun Jaitley Stadium,not out,84*,90,93.33,,4189,41.48,86.59
117,20/10/2011,England,Punjab Cricket Association IS Bindra Stadium,c K P Pietersen b S T Finn,58,60,96.67,,4247,41.64,86.71
118,23/10/2011,England,Wankhede Stadium,b S T Finn,1,6,16.67,,4248,41.24,86.62
119,25/10/2011,England,Eden Gardens,b S T Finn,38,46,82.61,,4286,41.21,86.59
120,29/11/2011,West Indies,Barabati Stadium,c †D Ramdin b K A J Roach,4,3,133.33,,4290,40.86,86.61
121,02/12/2011,West Indies,Dr YS Rajasekhara Reddy Cricket Stadium,c A B Barath b R Rampaul,12,18,66.67,,4302,40.58,86.54
122,05/12/2011,West Indies,Sardar Patel Stadium,lbw b R Rampaul,0,1,0.00,,4302,40.21,86.52
123,08/12/2011,West Indies,Holkar Cricket Stadium,run out,67,67,100.00,,4369,40.45,86.70
124,11/12/2011,West Indies,MA Chidambaram Stadium,lbw b A Martin,31,41,75.61,,4400,40.37,86.61
125,05/02/2012,Australia,Melbourne Cricket Ground,c †M S Wade b M A Starc,5,8,62.50,,4405,40.05,86.58
126,12/02/2012,Australia,Adelaide Oval,lbw b C J McKay,92,111,82.88,,4497,40.51,86.50
127,14/02/2012,Sri Lanka,Adelaide Oval,run out,91,106,85.85,,4588,40.96,86.48
128,19/02/2012,Australia,Brisbane Cricket Ground,c †M S Wade b B Lee,5,5,100.00,,4593,40.65,86.50
129,21/02/2012,Sri Lanka,Brisbane Cricket Ground,c N L T C Perera b K M D N Kulasekara,29,34,85.29,,4622,40.54,86.49
130,26/02/2012,Australia,Sydney Cricket Ground,b C J McKay,23,48,47.92,,4645,40.39,86.15
131,28/02/2012,Sri Lanka,Bellerive Oval,run out,63,64,98.44,,4708,40.59,86.29
132,13/03/2012,Sri Lanka,Shere Bangla National Stadium,c W U Tharanga b M F Maharoof,100,118,84.75,,4808,41.09,86.26
133,16/03/2012,Bangladesh,Shere Bangla National Stadium,b Shafiul Islam,11,16,68.75,,4819,40.84,86.21
134,18/03/2012,Pakistan,Shere Bangla National Stadium,lbw b Mohammad Hafeez,0,2,0.00,,4819,40.50,86.18
135,21/07/2012,Sri Lanka,Mahinda Rajapaksha International Cricket Stadium,b K M D N Kulasekara,3,6,50.00,,4822,40.18,86.14
136,24/07/2012,Sri Lanka,Mahinda Rajapaksha International Cricket Stadium,c †K C Sangakkara b S L Malinga,65,96,67.71,,4887,40.39,85.83
137,28/07/2012,Sri Lanka,R Premadasa Stadium,run out,102,101,100.99,,4989,40.89,86.09
138,31/07/2012,Sri Lanka,R Premadasa Stadium,b S L Malinga,0,5,0.00,,4989,40.56,86.02
139,04/08/2012,Sri Lanka,Pallekele International Cricket Stadium,c S L Malinga b S M S M Senanayake,88,99,88.89,,5077,40.94,86.07
140,30/12/2012,Pakistan,MA Chidambaram Stadium,b Mohammad Irfan,8,17,47.06,,5085,40.68,85.95
141,03/01/2013,Pakistan,Eden Gardens,b Junaid Khan,11,25,44.00,,5096,40.44,85.78
142,06/01/2013,Pakistan,Arun Jaitley Stadium,c Umar Akmal b Mohammad Irfan,15,27,55.56,,5111,40.24,85.64
143,11/01/2013,England,Saurashtra Cricket Association Stadium,c I R Bell b J C Tredwell,52,52,100.00,,5163,40.34,85.76
144,15/01/2013,England,Nehru Stadium (Kochi),b J W Dernbach,8,13,61.54,,5171,40.09,85.71
145,19/01/2013,England,JSCA International Stadium Complex,c J E Root b J C Tredwell,33,53,62.26,,5204,40.03,85.51
146,23/01/2013,England,Punjab Cricket Association IS Bindra Stadium,c †J C Buttler b T T Bresnan,10,16,62.50,,5214,39.80,85.45
147,27/01/2013,England,Himachal Pradesh Cricket Association Stadium,c I R Bell b J C Tredwell,24,42,57.14,,5238,39.68,85.25
No. of Innings Played = 143,No. of Innings Played = 143,No. of Innings Played = 143,No. of Innings Played = 143,No. of Innings Played = 143,No. of Innings Played = 143,No. of Innings Played = 143,No. of Innings Played = 143,No. of Innings Played = 143,No. of Innings Played = 143,,
