0,1,2,3,4,5,6,7,8,9,10,11
,,,,,,,,Progressive,Progressive,Progressive,Progressive
,,,,,,,,,,,
,Date,Versus,Ground,Batsman Dismissed,Overs,Wickets,,S/R,E/R,Wkts,Avg
1.0,10/04/2001,Sri Lanka,Sharjah Cricket Stadium,S T Jayasuriya (c M D Bell),7.0,1/39,,42.00,5.57,1,39.00
2.0,12/04/2001,Pakistan,Sharjah Cricket Stadium,Shahid Afridi (c J E C Franklin),8.0,1/38,,45.00,5.13,2,38.50
3.0,17/04/2001,Sri Lanka,Sharjah Cricket Stadium,,3.0,0/12,,54.00,4.94,,44.50
4.0,29/01/2002,Australia,Melbourne Cricket Ground,D R Martyn (c C Z Harris),10.0,2/52,,42.00,5.04,3,35.25
,,,,S K Warne (c S E Bond),,,,,,4,
5.0,01/02/2002,South Africa,WACA Ground,,10.0,0/57,,57.00,5.21,,49.50
6.0,06/02/2002,South Africa,Melbourne Cricket Ground,,8.0,0/32,,69.00,5.00,,57.50
7.0,08/02/2002,South Africa,Sydney Cricket Ground,J H Kallis (c †A C Parore),8.0,2/33,,54.00,4.87,5,43.83
,,,,H H Gibbs (b),,,,,,6,
8.0,13/02/2002,England,AMI Stadium,A R Caddick (c C Z Harris),6.2,2/25,,45.25,4.77,7,36.00
,,,,N Hussain (c †C J Nevin),,,,,,8,
9.0,16/02/2002,England,Westpac Stadium,G P Thorpe (lbw),7.0,3/13,,36.73,4.47,9,27.36
,,,,N V Knight (b),,,,,,10,
,,,,M E Trescothick (c †C J Nevin),,,,,,11,
10.0,20/02/2002,England,McLean Park,A Flintoff (c L Vincent),9.0,1/49,,38.17,4.59,12,29.17
11.0,23/02/2002,England,Eden Park,,8.0,0/36,,42.17,4.58,,32.17
12.0,26/02/2002,England,Carisbrook,G P Thorpe (b),10.0,2/50,,40.43,4.62,13,31.14
,,,,C White (c N J Astle),,,,,,14,
13.0,15/04/2002,Pakistan,Sharjah Cricket Stadium,,2.0,0/21,,41.29,4.74,,32.64
14.0,21/04/2002,Pakistan,National Stadium (Karachi),,10.0,0/41,,45.57,4.68,,35.57
15.0,24/04/2002,Pakistan,Rawalpindi Cricket Stadium,Inzamam-ul-Haq (b),10.0,2/58,,43.63,4.78,15,34.75
,,,,Mohammad Yousuf (b),,,,,,16,
16.0,27/04/2002,Pakistan,Gaddafi Stadium,Shahid Afridi (c M J Horne),8.0,2/57,,41.44,4.93,17,34.06
,,,,Shoaib Malik (c I G Butler),,,,,,18,
17.0,04/01/2003,India,Queenstown Events Centre,R Dravid (b),8.4,5/22,,34.70,4.77,19,27.61
,,,,A Nehra (c †B B McCullum),,,,,,20,
,,,,M Kaif (c C D McMillan),,,,,,21,
,,,,V Sehwag (c N J Astle),,,,,,22,
,,,,D Mongia (c D L Vettori),,,,,,23,
18.0,08/01/2003,India,Westpac Stadium,A Kumble (hit wicket),9.2,2/47,,34.16,4.79,24,27.28
,,,,M Kaif (c S P Fleming),,,,,,25,
19.0,11/01/2003,India,Eden Park,S C Ganguly (c †B B McCullum),9.5,3/41,,32.61,4.75,26,25.82
,,,,M Kaif (b),,,,,,27,
,,,,S B Bangar (lbw),,,,,,28,
20.0,14/01/2003,India,Seddon Park,A Kumble (c S P Fleming),8.5,4/21,,30.19,4.62,29,23.25
,,,,J Srinath (lbw),,,,,,30,
,,,,S C Ganguly (b),,,,,,31,
,,,,M Kaif (c †B B McCullum),,,,,,32,
21.0,10/02/2003,Sri Lanka,Mangaung Oval,W P U J C Vaas (b),9.0,2/58,,30.00,4.72,33,23.59
,,,,D P M D Jayawardene (lbw),,,,,,34,
22.0,13/02/2003,West Indies,St George's Park,C L Hooper (c S E Bond),9.4,4/44,,28.37,4.71,35,22.26
,,,,M V Dillon (b),,,,,,36,
,,,,W W Hinds (c S B Styris),,,,,,37,
,,,,C H Gayle (c S P Fleming),,,,,,38,
23.0,16/02/2003,South Africa,Wanderers Stadium,S M Pollock (c J D P Oram),9.0,1/57,,29.03,4.79,39,23.15
24.0,26/02/2003,Bangladesh,Diamond Oval,Alok Kapali (c S E Bond),10.0,1/50,,29.80,4.80,40,23.83
25.0,03/03/2003,Canada,Willowmoore Park,,6.0,0/38,,30.70,4.84,,24.78
26.0,08/03/2003,Zimbabwe,Mangaung Oval,D D Ebrahim (b),5.0,1/54,,30.68,4.98,41,25.49
27.0,11/03/2003,Australia,St George's Park,D S Lehmann (c N J Astle),9.0,1/46,,31.24,4.99,42,25.98
28.0,19/05/2003,Sri Lanka,Rangiri Dambulla International Stadium,R S Kaluwitharana (c †B B McCullum),3.0,1/14,,30.93,4.98,43,25.70
29.0,03/01/2004,Pakistan,Eden Park,,9.0,0/63,,32.19,5.06,,27.16
30.0,17/01/2004,Pakistan,Westpac Stadium,Abdul Razzaq (c H J H Marshall),9.0,1/69,,32.68,5.16,44,28.11
31.0,02/11/2004,Bangladesh,MA Aziz Stadium,,6.0,0/24,,33.50,5.13,,28.66
32.0,24/08/2005,Zimbabwe,Queens Sports Club,H Masakadza (c †B B McCullum),5.0,2/22,,32.70,5.12,45,27.89
,,,,C K Coventry (c K D Mills),,,,,,46,
33.0,26/08/2005,India,Queens Sports Club,A B Agarkar (c S P Fleming),8.0,3/37,,31.67,5.10,47,26.94
,,,,Yuvraj Singh (c S P Fleming),,,,,,48,
,,,,M S Dhoni (c †B B McCullum),,,,,,49,
34.0,02/09/2005,India,Harare Sports Club,,7.3,0/67,,32.59,5.21,,28.31
35.0,23/10/2005,South Africa,Mangaung Oval,G C Smith (b),6.0,1/28,,32.66,5.20,50,28.30
36.0,28/10/2005,South Africa,Newlands,,6.0,0/39,,33.38,5.23,,29.08
37.0,30/10/2005,South Africa,St George's Park,A G Prince (c K D Mills),10.0,2/40,,33.25,5.18,51,28.73
,,,,G C Smith (c †B B McCullum),,,,,,52,
38.0,28/12/2006,Sri Lanka,McLean Park,,7.0,0/54,,34.06,5.24,,29.77
39.0,31/12/2006,Sri Lanka,Queenstown Events Centre,,10.0,0/42,,35.21,5.21,,30.58
40.0,06/01/2007,Sri Lanka,Eden Park,M S Atapattu (c †B B McCullum),9.0,1/53,,35.57,5.23,53,31.00
