0,1,2,3,4,5,6,7,8,9,10,11
,,,,,,,,Progressive,Progressive,Progressive,Progressive
,,,,,,,,,,,
,Date,Versus,Ground,Batsman Dismissed,Overs,Wickets,,S/R,E/R,Wkts,Avg
1.0,18/12/2009,India,Vidarbha Cricket Association Stadium,,8.0,0/57,,,7.13,,
2.0,24/12/2009,India,Eden Gardens,V Sehwag (c T M Dilshan),10.0,2/55,,54.00,6.22,1,56.00
,,,,S R Tendulkar (c S Randiv),,,,,,2,
3.0,04/01/2010,Bangladesh,Shere Bangla National Stadium,Shakib Al Hasan (c U W M B C A Welegedara),9.0,2/63,,40.50,6.48,3,43.75
,,,,Raqibul Hasan (c T T Samaraweera),,,,,,4,
4.0,05/01/2010,India,Shere Bangla National Stadium,,8.0,0/48,,52.50,6.37,,55.75
5.0,10/01/2010,India,Shere Bangla National Stadium,,10.0,0/75,,67.50,6.62,,74.50
6.0,28/06/2011,England,Kennington Oval,I J L Trott (lbw),7.0,2/52,,52.00,6.73,5,58.33
,,,,E J G Morgan (c S H T Kandamby),,,,,,6,
7.0,01/07/2011,England,Headingley,C Kieswetter (c K M D N Kulasekara),7.5,3/43,,39.89,6.57,7,43.67
,,,,J W Dernbach (c K M D N Kulasekara),,,,,,8,
,,,,I J L Trott (b),,,,,,9,
8.0,03/07/2011,England,Lord's,I J L Trott (c T M Dilshan),10.0,2/62,,38.09,6.52,10,41.36
,,,,I R Bell (c K M D N Kulasekara),,,,,,11,
9.0,06/07/2011,England,Trent Bridge,,2.0,0/12,,39.18,6.50,,42.45
10.0,10/08/2011,Australia,Pallekele International Cricket Stadium,,5.0,0/39,,41.91,6.59,,46.00
11.0,11/11/2011,Pakistan,Dubai International Cricket Stadium,Imran Farhat (lbw),4.0,2/16,,37.31,6.46,12,40.15
,,,,Mohammad Hafeez (c C K B Kulasekara),,,,,,13,
12.0,13/03/2012,India,Shere Bangla National Stadium,S R Tendulkar (c D P M D Jayawardene),10.0,1/67,,38.93,6.48,14,42.07
13.0,15/03/2012,Pakistan,Shere Bangla National Stadium,Nasir Jamshed (c W U Tharanga),8.0,2/37,,37.06,6.33,15,39.13
,,,,Younis Khan (c M F Maharoof),,,,,,16,
14.0,20/03/2012,Bangladesh,Shere Bangla National Stadium,Jahurul Islam (c C K Kapugedera),7.1,1/44,,37.41,6.32,17,39.41
15.0,11/07/2013,India,Queen's Park Oval,S K Raina (c †K C Sangakkara),10.0,1/33,,38.67,6.06,18,39.06
16.0,31/07/2013,South Africa,R Premadasa Stadium,L L Tsotsobe (b),5.5,3/22,,34.81,5.95,19,34.52
,,,,D A Miller (c †K C Sangakkara),,,,,,20,
,,,,F Behardien (c A D Mathews),,,,,,21,
17.0,18/12/2013,Pakistan,Sharjah Cricket Stadium,Ahmed Shehzad (lbw),10.0,2/73,,34.39,6.05,22,34.70
,,,,Mohammad Hafeez (c L D Chandimal),,,,,,23,
18.0,25/12/2013,Pakistan,Sheikh Zayed Stadium,Ahmed Shehzad (c S M S M Senanayake),9.0,1/49,,35.21,6.01,24,35.29
19.0,27/12/2013,Pakistan,Sheikh Zayed Stadium,Ahmed Shehzad (c S M A Priyanjan),7.3,3/42,,32.96,5.99,25,32.93
,,,,Junaid Khan (lbw),,,,,,26,
,,,,Saeed Ajmal (lbw),,,,,,27,
20.0,22/02/2014,Bangladesh,Shere Bangla National Stadium,Mahmudullah (c H D R L Thirimanne),10.0,2/24,,32.76,5.77,28,31.48
,,,,Nasir Hossain (c S M A Priyanjan),,,,,,29,
21.0,25/02/2014,Pakistan,Khan Shaheb Osman Ali Stadium,Sharjeel Khan (c A D Mathews),9.0,2/65,,32.39,5.84,30,31.55
,,,,Umar Akmal (c †K C Sangakkara),,,,,,31,
22.0,03/03/2014,Afghanistan,Shere Bangla National Stadium,Samiullah Shinwari (c H D R L Thirimanne),7.0,2/30,,31.70,5.78,32,30.55
,,,,Mohammad Shahzad (b),,,,,,33,
23.0,06/03/2014,Bangladesh,Shere Bangla National Stadium,Nasir Hossain (c D P M D Jayawardene),10.0,2/32,,31.60,5.64,34,29.71
,,,,Mahmudullah (b),,,,,,35,
24.0,08/03/2014,Pakistan,Shere Bangla National Stadium,,10.0,0/41,,33.31,5.56,,30.89
25.0,06/05/2014,Ireland,Castle Avenue,K J O'Brien (c S M S M Senanayake),8.0,3/29,,31.95,5.49,36,29.21
,,,,E C Joyce (c †L D Chandimal),,,,,,37,
,,,,A R Cusack (b),,,,,,38,
26.0,22/05/2014,England,Kennington Oval,,6.0,0/34,,32.89,5.49,,30.11
27.0,13/12/2014,England,Pallekele International Cricket Stadium,J E Root (b),8.0,4/30,,30.90,5.43,39,27.95
,,,,R S Bopara (c †K C Sangakkara),,,,,,40,
,,,,C J Jordan (c †K C Sangakkara),,,,,,41,
,,,,E J G Morgan (c †K C Sangakkara),,,,,,42,
28.0,16/12/2014,England,R Premadasa Stadium,A N Cook (c D P M D Jayawardene),8.0,2/25,,30.59,5.34,43,27.25
,,,,J W A Taylor (c †K C Sangakkara),,,,,,44,
29.0,23/01/2015,New Zealand,University Oval,,10.0,0/93,,31.95,5.51,,29.36
30.0,25/01/2015,New Zealand,University Oval,,7.0,0/31,,32.91,5.48,,30.07
31.0,14/02/2015,New Zealand,Hagley Oval,G D Elliott (c H D R L Thirimanne),10.0,2/62,,32.78,5.51,45,30.11
,,,,M J Guptill (c †K C Sangakkara),,,,,,46,
32.0,22/02/2015,Afghanistan,University Oval,Javed Ahmadi (c H M R K B Herath),10.0,2/36,,32.67,5.44,47,29.60
,,,,Najibullah Zadran (c N L T C Perera),,,,,,48,
33.0,26/02/2015,Bangladesh,Melbourne Cricket Ground,Mominul Haque (c D P M D Jayawardene),8.0,2/49,,32.32,5.46,49,29.40
,,,,Mushfiqur Rahim (b),,,,,,50,
34.0,01/03/2015,England,Westpac Stadium,I R Bell (b),7.4,1/71,,32.59,5.56,51,30.22
35.0,11/07/2015,Pakistan,Rangiri Dambulla International Stadium,Ahmed Shehzad (c †L D Chandimal),5.0,1/21,,32.54,5.54,52,30.04
36.0,22/07/2015,Pakistan,R Premadasa Stadium,Ahmed Shehzad (c M D K J Perera),8.0,1/50,,32.83,5.56,53,30.42
37.0,26/07/2015,Pakistan,Mahinda Rajapaksha International Cricket Stadium,,6.0,0/35,,33.51,5.56,,31.08
38.0,01/11/2015,West Indies,R Premadasa Stadium,M N Samuels (lbw),5.0,3/15,,32.25,5.52,54,29.68
,,,,A D S Fletcher (c T M Dilshan),,,,,,55,
,,,,J Charles (lbw),,,,,,56,
39.0,04/11/2015,West Indies,R Premadasa Stadium,J L Carter (b),7.0,1/51,,32.42,5.56,57,30.05
40.0,07/11/2015,West Indies,Pallekele International Cricket Stadium,A D S Fletcher (lbw),7.0,2/40,,32.03,5.57,58,29.71
,,,,D M Bravo (b),,,,,,59,
41.0,26/12/2015,New Zealand,Hagley Oval,,3.0,0/24,,32.34,5.59,,30.12
42.0,18/06/2016,Ireland,The Village,W T S Porterfield (c A D Mathews),10.0,4/38,,31.24,5.53,60,28.81
,,,,S W Poynter (c M D Gunathilaka),,,,,,61,
,,,,P R Stirling (c †L D Chandimal),,,,,,62,
,,,,T J Murtagh (c A D Mathews),,,,,,63,
43.0,21/06/2016,England,Trent Bridge,A D Hales (c M D K J Perera),10.0,2/65,,31.20,5.56,64,28.92
,,,,J M Bairstow (c M D Gunathilaka),,,,,,65,
44.0,24/06/2016,England,Edgbaston,,5.0,0/21,,31.66,5.54,,29.25
45.0,26/06/2016,England,County Ground (Bristol),A D Hales (c †L D Chandimal),2.0,1/8,,31.36,5.53,66,28.92
46.0,29/06/2016,England,Kennington Oval,E J G Morgan (c M D Gunathilaka),7.0,1/48,,31.52,5.56,67,29.21
47.0,02/07/2016,England,Sophia Gardens,J J Roy (c M D K J Perera),10.0,1/65,,31.94,5.59,68,29.74
48.0,04/09/2016,Australia,Pallekele International Cricket Stadium,,8.0,0/30,,32.65,5.55,,30.18
49.0,14/11/2016,Zimbabwe,Harare Sports Club,C R Ervine (c B K G Mendis),7.0,2/19,,32.31,5.49,69,29.59
,,,,B B Chari (c B K G Mendis),,,,,,70,
50.0,16/11/2016,West Indies,Harare Sports Club,J Charles (c M D K J Perera),9.2,2/45,,32.19,5.48,71,29.39
,,,,S T Gabriel (lbw),,,,,,72,
51.0,21/11/2016,Zimbabwe,Queens Sports Club,,4.0,0/14,,32.53,5.46,,29.58
52.0,23/11/2016,West Indies,Queens Sports Club,A R Nurse (c †N Dickwella),10.0,2/67,,32.46,5.49,73,29.69
,,,,J Charles (c W U Tharanga),,,,,,74,
53.0,27/11/2016,Zimbabwe,Queens Sports Club,P J Moor (c S S Pathirana),6.0,1/23,,32.51,5.46,75,29.60
54.0,28/01/2017,South Africa,St George's Park,,6.0,0/29,,32.99,5.45,,29.99
55.0,01/02/2017,South Africa,Kingsmead,C H Morris (c B K G Mendis),7.0,2/54,,32.68,5.49,76,29.91
,,,,H M Amla (lbw),,,,,,77,
56.0,04/02/2017,South Africa,Wanderers Stadium,,6.0,0/23,,33.14,5.47,,30.21
57.0,10/02/2017,South Africa,SuperSport Park,F Behardien (c D A S Gunaratne),10.0,3/71,,32.65,5.51,78,29.96
,,,,Q de Kock (c D S Weerakkody),,,,,,79,
,,,,J-P Duminy (c †N Dickwella),,,,,,80,
58.0,25/03/2017,Bangladesh,Rangiri Dambulla International Stadium,Shakib Al Hasan (c P A D L R Sandakan),8.0,2/45,,32.44,5.51,81,29.78
,,,,Soumya Sarkar (c †L D Chandimal),,,,,,82,
59.0,01/04/2017,Bangladesh,Sinhalese Sports Club Ground,Mushfiqur Rahim (lbw),8.0,2/38,,32.24,5.49,83,29.52
,,,,Mahmudullah (c †L D Chandimal),,,,,,84,
60.0,03/06/2017,South Africa,Kennington Oval,D A Miller (c S Prasanna),10.0,1/51,,32.56,5.49,85,29.78
61.0,08/06/2017,India,Kennington Oval,H H Pandya (c M D K J Perera),10.0,1/72,,32.88,5.52,86,30.27
62.0,12/06/2017,Pakistan,Sophia Gardens,Azhar Ali (c B K G Mendis),10.0,1/48,,33.20,5.51,87,30.47
63.0,13/10/2017,Pakistan,Dubai International Cricket Stadium,Babar Azam (c B K G Mendis),10.0,2/47,,33.12,5.49,88,30.31
,,,,Shoaib Malik (c A Dananjaya),,,,,,89,
64.0,16/10/2017,Pakistan,Sheikh Zayed Stadium,Ahmed Shehzad (c T A M Siriwardana),10.0,1/42,,33.42,5.47,90,30.44
65.0,20/10/2017,Pakistan,Sharjah Cricket Stadium,,7.0,0/25,,33.89,5.44,,30.72
66.0,10/12/2017,India,Himachal Pradesh Cricket Association Stadium,M K Pandey (c A D Mathews),10.0,4/13,,33.09,5.36,91,29.55
,,,,R G Sharma (c †N Dickwella),,,,,,92,
,,,,B Kumar (c †N Dickwella),,,,,,93,
,,,,K D Karthik (lbw),,,,,,94,
67.0,13/12/2017,India,Punjab Cricket Association IS Bindra Stadium,,8.0,0/71,,33.60,5.41,,30.31
68.0,17/12/2017,India,Dr YS Rajasekhara Reddy Cricket Stadium,,5.0,0/20,,33.91,5.40,,30.52
69.0,17/01/2018,Zimbabwe,Shere Bangla National Stadium,C R Ervine (c A D Mathews),10.0,1/70,,34.19,5.43,95,30.94
70.0,19/01/2018,Bangladesh,Shere Bangla National Stadium,,9.0,0/60,,34.76,5.45,,31.57
71.0,21/01/2018,Zimbabwe,Shere Bangla National Stadium,,7.0,0/23,,35.20,5.42,,31.81
72.0,25/01/2018,Bangladesh,Shere Bangla National Stadium,Tamim Iqbal (c M D Gunathilaka),7.0,3/21,,34.55,5.39,96,31.05
,,,,Anamul Haque (b),,,,,,97,
,,,,Mahmudullah (c P V D Chameera),,,,,,98,
73.0,27/01/2018,Bangladesh,Shere Bangla National Stadium,,9.0,0/29,,35.10,5.36,,31.35
74.0,29/07/2018,South Africa,Rangiri Dambulla International Stadium,D A Miller (lbw),6.0,1/37,,35.11,5.37,99,31.40
75.0,01/08/2018,South Africa,Rangiri Dambulla International Stadium,D A Miller (c B K G Mendis),7.0,1/39,,35.18,5.37,100,31.48
76.0,05/08/2018,South Africa,Pallekele International Cricket Stadium,,9.0,0/59,,35.72,5.39,,32.07
77.0,08/08/2018,South Africa,Pallekele International Cricket Stadium,P W A Mulder (c D M de Silva),5.0,3/46,,34.97,5.42,101,31.58
,,,,D A Miller (b),,,,,,102,
,,,,Q de Kock (b),,,,,,103,
78.0,12/08/2018,South Africa,R Premadasa Stadium,H M Amla (b),4.0,1/22,,34.87,5.42,104,31.49
79.0,15/09/2018,Bangladesh,Dubai International Cricket Stadium,Mehidy Hasan Miraz (c & b),10.0,1/46,,35.10,5.41,105,31.63
80.0,21/05/2019,Scotland,Grange Cricket Club,M A Leask (c W I A Fernando),7.0,2/55,,34.84,5.43,106,31.55
,,,,M H Cross (c W I A Fernando),,,,,,107,
81.0,01/06/2019,New Zealand,Sophia Gardens,,4.0,0/28,,35.07,5.44,,31.81
82.0,04/06/2019,Afghanistan,Sophia Gardens,,6.0,0/27,,35.40,5.43,,32.07
83.0,28/06/2019,South Africa,Riverside Ground,,4.0,0/18,,35.63,5.43,,32.23
