0,1,2,3,4,5,6,7,8,9,10,11
,,,,,,,,,Progressive,Progressive,Progressive
,,,,,,,,,,,
,Date,Versus,Ground,How Dismissed,Runs,B/F,S/R,,Aggr,Avg,S/R
1,25/09/2016,Bangladesh,Shere Bangla National Stadium,not out,0*,1,0.00,,0,,0.00
2,28/09/2016,Bangladesh,Shere Bangla National Stadium,did not bat,-,-,-,,0,,0.00
3,06/11/2019,West Indies,Bharat Ratna Shri Atal Bihari Vajpayee Ekana Cricket Stadium,c K A Pollard b R Shepherd,1,9,11.11,,1,1.00,10.00
4,09/11/2019,West Indies,Bharat Ratna Shri Atal Bihari Vajpayee Ekana Cricket Stadium,not out,8*,11,72.73,,9,9.00,42.86
No. of Innings Played = 3,No. of Innings Played = 3,No. of Innings Played = 3,No. of Innings Played = 3,No. of Innings Played = 3,No. of Innings Played = 3,No. of Innings Played = 3,No. of Innings Played = 3,No. of Innings Played = 3,No. of Innings Played = 3,,
