0,1,2,3,4,5,6,7,8,9,10,11
,,,,,,,,Progressive,Progressive,Progressive,Progressive
,,,,,,,,,,,
,Date,Versus,Ground,Batsman Dismissed,Overs,Wickets,,S/R,E/R,Wkts,Avg
1.0,19/05/2017,Ireland,The Village,E C Joyce (c Tamim Iqbal),5.0,2/22,,15.00,4.40,1,11.00
,,,,B J McCarthy (lbw),,,,,,2,
2.0,15/01/2018,Zimbabwe,Shere Bangla National Stadium,M N Waller (c Sabbir Rahman),10.0,1/29,,30.00,3.40,3,17.00
3.0,23/01/2018,Zimbabwe,Shere Bangla National Stadium,M N Waller (lbw),10.0,2/28,,30.00,3.16,4,15.80
,,,,P J Moor (lbw),,,,,,5,
